{
  "schema_version": "1.0.0",
  "project_id": "dry-run-002",
  "created_at": "2026-09-22T14:40:00Z",
  "status": "approved",
  "technical_qa": {
    "status": "pass",
    "checks": [
      { "criterion": "codec", "expected": "h264/aac", "measured": "SIMULATED: h264/aac", "result": "pass" },
      { "criterion": "resolution", "expected": "1080x1920", "measured": "SIMULATED: 1080x1920", "result": "pass" },
      { "criterion": "duration_seconds", "expected": "~13s", "measured": "SIMULATED: 13s", "result": "pass" }
    ]
  },
  "visual_qa": {
    "status": "pass",
    "checks": [
      { "criterion": "sem artefatos óbvios de geração", "result": "pass", "notes": "SIMULATED — nenhum frame real foi inspecionado; Remotion foi pulado nesta simulação porque asset-manifest.json já representa um vídeo final pronto de product_to_videos, conforme a regra de decisão de FLOW.md." },
      { "criterion": "legibilidade de legenda", "result": "pass", "notes": "SIMULATED — sem legenda customizada nesta simulação (Remotion pulado)." }
    ]
  },
  "tiktok_format_qa": {
    "status": "needs_review",
    "checks": [
      { "criterion": "aspect_ratio 9:16", "result": "pass" },
      { "criterion": "duração dentro do limite de vídeo de produto", "result": "pass" },
      { "criterion": "tamanho de arquivo dentro do limite de upload", "result": "needs_review" }
    ]
  },
  "responsible_agent_for_fix": null
}
